{
  "schema_version": "capture_manifest_v1",
  "manifest_id": "target_rig_finetune_fixture_v1",
  "evidence_scope": "synthetic_fixture",
  "rig_acceptance": {
    "result_path": "receipts/synthetic_fixture_only.json",
    "result_sha256": "0000000000000000000000000000000000000000000000000000000000000000"
  },
  "frames": [
    {
      "frame_id": "train_known_frame",
      "image_path": "finetune_images/train_known.jpg",
      "image_sha256": "e99c0fc58cc3e0696ded5dc51214bc15f3f82251b9446db9424c7e77fbac27aa",
      "field_id": "field_train",
      "session_id": "session_train",
      "video_id": "video_train",
      "frame_index": 0,
      "timestamp_ns": 1000000000,
      "camera_frame_counter": 100,
      "camera_timestamp_ns": 1000000100,
      "encoder_mm": 0.0,
      "exposure_us": 170.0,
      "gain_db": 2.0,
      "white_balance": {"mode": "manual", "red_gain": 1.1, "green_gain": 1.0, "blue_gain": 1.2},
      "working_distance_mm": 480.0,
      "native_width_px": 1024,
      "native_height_px": 1024,
      "pixel_format": "RGB8",
      "camera_id": "fixture_camera",
      "rig_id": "fixture_rig",
      "capture_profile_id": "fixture_profile",
      "strobe_profile_id": "fixture_strobe",
      "strobe_settings": {"profile_id": "fixture_strobe", "pulse_width_us": 150.0, "peak_current_a": 3.2},
      "split": "train",
      "instances": [
        {
          "instance_id": "train_crop_instance",
          "track_id": "train_crop_track",
          "class_name": "crop",
          "polygon": [[0.55, 0.10], [0.75, 0.10], [0.75, 0.35], [0.55, 0.35]],
          "visible_fraction": 1.0,
          "canopy_span_mm": 28.0,
          "partial": false,
          "occluded": false
        },
        {
          "instance_id": "train_weed_instance",
          "track_id": "train_weed_track",
          "class_name": "weed",
          "polygon": [[0.10, 0.10], [0.30, 0.10], [0.30, 0.30], [0.10, 0.30]],
          "visible_fraction": 1.0,
          "canopy_span_mm": 24.0,
          "partial": false,
          "occluded": false
        }
      ]
    },
    {
      "frame_id": "train_partial_unknown",
      "image_path": "finetune_images/train_unknown.jpg",
      "image_sha256": "2b484ad35f2953384e9f8c2d193499d487860599e60313c3e29d78e652346bc4",
      "field_id": "field_train",
      "session_id": "session_train",
      "video_id": "video_train",
      "frame_index": 1,
      "timestamp_ns": 1066666667,
      "camera_frame_counter": 101,
      "camera_timestamp_ns": 1066666767,
      "encoder_mm": 66.7,
      "exposure_us": 170.0,
      "gain_db": 2.0,
      "white_balance": {"mode": "manual", "red_gain": 1.1, "green_gain": 1.0, "blue_gain": 1.2},
      "working_distance_mm": 480.0,
      "native_width_px": 1024,
      "native_height_px": 1024,
      "pixel_format": "RGB8",
      "camera_id": "fixture_camera",
      "rig_id": "fixture_rig",
      "capture_profile_id": "fixture_profile",
      "strobe_profile_id": "fixture_strobe",
      "strobe_settings": {"profile_id": "fixture_strobe", "pulse_width_us": 150.0, "peak_current_a": 3.2},
      "split": "train",
      "instances": [
        {
          "instance_id": "unknown_border_instance",
          "track_id": "unknown_border_track",
          "class_name": "partial_unknown",
          "polygon": [[0.00, 0.40], [0.12, 0.40], [0.12, 0.62], [0.00, 0.62]],
          "visible_fraction": 0.45,
          "canopy_span_mm": null,
          "partial": true,
          "occluded": false
        }
      ]
    },
    {
      "frame_id": "validation_known_frame",
      "image_path": "finetune_images/validation_known.jpg",
      "image_sha256": "cad99cd5006fc84a81734e1688090bbf46bd9e5b916cf637cf309cdd3b1bd4be",
      "field_id": "field_validation",
      "session_id": "session_validation",
      "video_id": "video_validation",
      "frame_index": 0,
      "timestamp_ns": 2000000000,
      "camera_frame_counter": 200,
      "camera_timestamp_ns": 2000000100,
      "encoder_mm": 0.0,
      "exposure_us": 170.0,
      "gain_db": 2.0,
      "white_balance": {"mode": "manual", "red_gain": 1.1, "green_gain": 1.0, "blue_gain": 1.2},
      "working_distance_mm": 480.0,
      "native_width_px": 1024,
      "native_height_px": 1024,
      "pixel_format": "RGB8",
      "camera_id": "fixture_camera",
      "rig_id": "fixture_rig",
      "capture_profile_id": "fixture_profile",
      "strobe_profile_id": "fixture_strobe",
      "strobe_settings": {"profile_id": "fixture_strobe", "pulse_width_us": 150.0, "peak_current_a": 3.2},
      "split": "validation",
      "instances": [
        {
          "instance_id": "validation_weed_instance",
          "track_id": "validation_weed_track",
          "class_name": "weed",
          "polygon": [[0.20, 0.20], [0.42, 0.20], [0.42, 0.44], [0.20, 0.44]],
          "visible_fraction": 0.95,
          "canopy_span_mm": 26.0,
          "partial": false,
          "occluded": false
        }
      ]
    },
    {
      "frame_id": "test_secret_frame",
      "image_path": "finetune_images/test_secret.jpg",
      "image_sha256": "c9487cb4eaf652945d29bf047b464be399ef908337cbf3e3c722311dc4340783",
      "field_id": "field_test",
      "session_id": "session_test",
      "video_id": "video_test",
      "frame_index": 0,
      "timestamp_ns": 3000000000,
      "camera_frame_counter": 300,
      "camera_timestamp_ns": 3000000100,
      "encoder_mm": 0.0,
      "exposure_us": 170.0,
      "gain_db": 2.0,
      "white_balance": {"mode": "manual", "red_gain": 1.1, "green_gain": 1.0, "blue_gain": 1.2},
      "working_distance_mm": 480.0,
      "native_width_px": 1024,
      "native_height_px": 1024,
      "pixel_format": "RGB8",
      "camera_id": "fixture_camera",
      "rig_id": "fixture_rig",
      "capture_profile_id": "fixture_profile",
      "strobe_profile_id": "fixture_strobe",
      "strobe_settings": {"profile_id": "fixture_strobe", "pulse_width_us": 150.0, "peak_current_a": 3.2},
      "split": "test",
      "instances": [
        {
          "instance_id": "test_weed_instance",
          "track_id": "test_weed_track",
          "class_name": "weed",
          "polygon": [[0.30, 0.30], [0.50, 0.30], [0.50, 0.50], [0.30, 0.50]],
          "visible_fraction": 1.0,
          "canopy_span_mm": 30.0,
          "partial": false,
          "occluded": false
        }
      ]
    }
  ]
}
